{
  "artifact_path": "/tmp/x",
  "artifact_sha256": "aaaaaaaaaaaaaaaaaaaaaaaaaaaaaaaaaaaaaaaaaaaaaaaaaaaaaaaaaaaaaaaa",
  "attempt_id": "attempt-001",
  "base_sha": "bbbbbbbbbbbbbbbbbbbbbbbbbbbbbbbbbbbbbbbb",
  "candidate_tree_sha256": "aaaaaaaaaaaaaaaaaaaaaaaaaaaaaaaaaaaaaaaaaaaaaaaaaaaaaaaaaaaaaaaa",
  "inventory": [
    {
      "kind": "file",
      "mode": 0,
      "path": "x",
      "sha256": "aaaaaaaaaaaaaaaaaaaaaaaaaaaaaaaaaaaaaaaaaaaaaaaaaaaaaaaaaaaaaaaa",
      "size_bytes": 0
    }
  ],
  "issue_id": "x",
  "observed_head_sha": "bbbbbbbbbbbbbbbbbbbbbbbbbbbbbbbbbbbbbbbb",
  "ownership_epoch": 0,
  "packaging_tool_version": "x",
  "reproduction_status": "reproduced",
  "run_id": "run-0123456789abcdef-20260903T120000.000000Z-ABCDEFGH",
  "schema_version": "beads.lane-freeze.v1",
  "transfer_mode": "commit",
  "worker_result_sha256": "aaaaaaaaaaaaaaaaaaaaaaaaaaaaaaaaaaaaaaaaaaaaaaaaaaaaaaaaaaaaaaaa"
}
